{"created_at_utc":"2026-10-10T18:01:41.112221Z","derived_from":[],"evidence_id":"EV-INTENT-4b1e3c26a65a","expected_state":"INTENT_RECORDED","observed_state":"INTENT_RECORDED","path":"evidence\\runtime\\RUN-SL09-LIVE\\intent-2da6a607b692478e9cd2d42f49c62282.json","redacted":true,"run_id":"RUN-SL09-LIVE","sha256":"bc42e49c3a4589bf5ed3d1a45d86fe2cc11cf2a5deb1fca6d5edc5d6e1a4b1ee","source":"EXECUTOR"}