{"created_at_utc":"2026-10-10T17:24:35.778608Z","derived_from":[],"evidence_id":"EV-RESULT-a6bc34685085","expected_state":"DISPATCH_CONFIRMED","observed_state":"DISPATCH_CONFIRMED","path":"evidence\\runtime\\RUN-SL08-LIVE\\result-9b4de3bdf9a1488588c3aa24d908db33.json","redacted":true,"run_id":"RUN-SL08-LIVE","sha256":"0dae74ad160a1a5902b780cc1120c233d61e4d42d63a2de16618666983925a23","source":"EXECUTOR"}