{"created_at_utc":"2026-10-11T09:56:01.475108Z","derived_from":[],"evidence_id":"EV-ACTION_WEB_001_VERIFICATION-002bb30db20e","expected_state":"PHASE_RECORDED","observed_state":"PHASE_RECORDED","path":"evidence\\runtime\\RUN-AUTONOMOUS-PENTEST-1791712555\\action_web_001_verification-ab6a273c63904ba7a665dfa14219ff4f.json","redacted":true,"run_id":"RUN-AUTONOMOUS-PENTEST-1791712555","sha256":"19f058b866b6065d560d7d1a2592761b4d10842957ad86244a97f8085507df20","source":"EXECUTOR"}