{"created_at_utc":"2026-10-11T09:56:00.732594Z","derived_from":[],"evidence_id":"EV-INTENT-7fd2fd122ce7","expected_state":"INTENT_RECORDED","observed_state":"INTENT_RECORDED","path":"evidence\\runtime\\RUN-AUTONOMOUS-PENTEST-1791712555\\intent-831bf77ffb914d6a966fe0429f321f63.json","redacted":true,"run_id":"RUN-AUTONOMOUS-PENTEST-1791712555","sha256":"a5b2d5eaacfb83d10d20894c394da42f33310cfc6e217ab664f24148d246c800","source":"EXECUTOR"}