{"created_at_utc":"2026-10-11T09:56:43.962319Z","derived_from":[],"evidence_id":"EV-ACTION_WEB_001_VERIFICATION-fb05eb3aaad4","expected_state":"PHASE_RECORDED","observed_state":"PHASE_RECORDED","path":"evidence\\runtime\\RUN-AUTONOMOUS-PENTEST-1791712598\\action_web_001_verification-9abf304f124946f3910a5e992c14a797.json","redacted":true,"run_id":"RUN-AUTONOMOUS-PENTEST-1791712598","sha256":"0f90d64ebeca3b8a827394714304256bd9525a40c8aba10448acdd0954cbbdea","source":"EXECUTOR"}