{"created_at_utc":"2026-10-11T13:06:50.130826Z","derived_from":[],"evidence_id":"EV-INTENT-7db9ebae33d4","expected_state":"INTENT_RECORDED","observed_state":"INTENT_RECORDED","path":"evidence\\runtime\\RUN-AUTONOMOUS-PENTEST-1791723996\\intent-65fe3d7807d24e5c9ad54888a732a6f3.json","redacted":true,"run_id":"RUN-AUTONOMOUS-PENTEST-1791723996","sha256":"52dfdf6e1bd2388067b5e16e5663bbab4c20af29cbc3d731b9f6c4f0d8f0d670","source":"EXECUTOR"}