{"created_at_utc":"2026-10-11T13:06:47.995139Z","derived_from":[],"evidence_id":"EV-RESULT-a32906cefed8","expected_state":"DISPATCH_CONFIRMED","observed_state":"DISPATCH_CONFIRMED","path":"evidence\\runtime\\RUN-AUTONOMOUS-PENTEST-1791723996\\result-cdc97dc296fe4f7783efc081f36fec19.json","redacted":true,"run_id":"RUN-AUTONOMOUS-PENTEST-1791723996","sha256":"3c58267290d3adc6364e4969b42789cb75ceaaf7d25552c2dd8dff4a553f5bd0","source":"EXECUTOR"}