{"created_at_utc":"2026-10-11T07:33:12.444878Z","derived_from":[],"evidence_id":"EV-RESULT-7923a0f4b9d6","expected_state":"DISPATCH_CONFIRMED","observed_state":"DISPATCH_CONFIRMED","path":"evidence\\runtime\\RUN-SL11-LIVE\\result-dda129ae189c4343ac6b79262672f57f.json","redacted":true,"run_id":"RUN-SL11-LIVE","sha256":"f4ad7ed3af94cb0432ad823eb7676f4c0b0bfe801efde9e5be7d5fca644949df","source":"EXECUTOR"}