{"created_at_utc":"2026-10-11T09:56:42.010597Z","derived_from":[],"evidence_id":"EV-INTENT-66b9cfeb0e98","expected_state":"INTENT_RECORDED","observed_state":"INTENT_RECORDED","path":"evidence\\runtime\\RUN-AUTONOMOUS-PENTEST-1791712598\\intent-d56f1413b01b4798bfd667a01af66a71.json","redacted":true,"run_id":"RUN-AUTONOMOUS-PENTEST-1791712598","sha256":"4b191567caa541dc9632a3af09823115b065db28189fc50490bbbadb02b4bda3","source":"EXECUTOR"}