{"created_at_utc":"2026-10-11T13:06:50.583154Z","derived_from":[],"evidence_id":"EV-AUTONOMOUS_PENTEST_REPORT-d193d02dfcf8","expected_state":"PHASE_RECORDED","observed_state":"PHASE_RECORDED","path":"evidence\\runtime\\RUN-AUTONOMOUS-PENTEST-1791723996\\autonomous_pentest_report-c713a7535e8640e5ba37b92690f14cf2.json","redacted":true,"run_id":"RUN-AUTONOMOUS-PENTEST-1791723996","sha256":"fd07d353b2e8428e99586e6f31214525f0bcdb0dde16014f3b2ac4047ba1acbb","source":"EXECUTOR"}