{"created_at_utc":"2026-10-11T09:55:59.752680Z","derived_from":[],"evidence_id":"EV-INTENT-da8daebec2e1","expected_state":"INTENT_RECORDED","observed_state":"INTENT_RECORDED","path":"evidence\\runtime\\RUN-AUTONOMOUS-PENTEST-1791712555\\intent-1d44eca6cae14c87b699a336fa14f847.json","redacted":true,"run_id":"RUN-AUTONOMOUS-PENTEST-1791712555","sha256":"f378fc5c91c560e854d91b03af2665f342630d3d201bd850f35d03d36d635858","source":"EXECUTOR"}