{"created_at_utc":"2026-10-11T13:06:48.009552Z","derived_from":[],"evidence_id":"EV-INTENT-dbca2bac46e7","expected_state":"INTENT_RECORDED","observed_state":"INTENT_RECORDED","path":"evidence\\runtime\\RUN-AUTONOMOUS-PENTEST-1791723996\\intent-ea7c7cf50a384f028a98f15ff7c572ad.json","redacted":true,"run_id":"RUN-AUTONOMOUS-PENTEST-1791723996","sha256":"23bc04bfebb857f38091db8a18f1f93dda9022e26e018be21472cebb60f9af9a","source":"EXECUTOR"}