{"created_at_utc":"2026-10-11T07:33:12.477305Z","derived_from":[],"evidence_id":"EV-RESULT-1ffce79c7971","expected_state":"DISPATCH_CONFIRMED","observed_state":"DISPATCH_CONFIRMED","path":"evidence\\runtime\\RUN-SL11-LIVE\\result-a1f24ccfb95b4ed4882417561a5a193c.json","redacted":true,"run_id":"RUN-SL11-LIVE","sha256":"bf86b829f8c66125bcc18608688f5fbb9fc22370485c1b38ce74a5e5ca395bcb","source":"EXECUTOR"}