{"created_at_utc":"2026-10-11T09:56:42.129244Z","derived_from":[],"evidence_id":"EV-INTENT-8390d12b0e7c","expected_state":"INTENT_RECORDED","observed_state":"INTENT_RECORDED","path":"evidence\\runtime\\RUN-AUTONOMOUS-PENTEST-1791712598\\intent-1b20052424634a47a3b75521b6b22817.json","redacted":true,"run_id":"RUN-AUTONOMOUS-PENTEST-1791712598","sha256":"34131e37a70c19b86aeb39419b251603b61ad63f92fe8a17d1bd911d92f83267","source":"EXECUTOR"}