{"created_at_utc":"2026-10-11T07:33:12.574212Z","derived_from":[],"evidence_id":"EV-INTENT-ee16a3e8b250","expected_state":"INTENT_RECORDED","observed_state":"INTENT_RECORDED","path":"evidence\\runtime\\RUN-SL11-LIVE\\intent-5c2571e943a142d88ab54aea2a1c9680.json","redacted":true,"run_id":"RUN-SL11-LIVE","sha256":"5934dbe31ee419b6481404313a301ea0e4b93a93d74f16854aaaba97e42bf2b1","source":"EXECUTOR"}