{"created_at_utc":"2026-10-10T18:01:41.369400Z","derived_from":[],"evidence_id":"EV-RESULT-0f1b4a34234b","expected_state":"DISPATCH_CONFIRMED","observed_state":"DISPATCH_CONFIRMED","path":"evidence\\runtime\\RUN-SL09-LIVE\\result-75d29fedd1da453e989a2c9752403787.json","redacted":true,"run_id":"RUN-SL09-LIVE","sha256":"5b2626ff1c57d4af4a872c423cd4628a044e458ed4948dfc7c67e8e810cb18fb","source":"EXECUTOR"}