{"created_at_utc":"2026-10-11T08:43:54.485508Z","derived_from":[],"evidence_id":"EV-INTENT-1bc0c9574050","expected_state":"INTENT_RECORDED","observed_state":"INTENT_RECORDED","path":"evidence\\runtime\\RUN-AUTONOMOUS-LIVE-1791708234\\intent-a6d295fae04041bf90d0ddefde545370.json","redacted":true,"run_id":"RUN-AUTONOMOUS-LIVE-1791708234","sha256":"e11398b93676d56ceee44cb5cac0b7922754b0332fd99986c6fc3d512d4714ae","source":"EXECUTOR"}