{"created_at_utc":"2026-10-11T07:47:33.975383Z","derived_from":[],"evidence_id":"EV-INTENT-2dc6a6c5fc93","expected_state":"INTENT_RECORDED","observed_state":"INTENT_RECORDED","path":"evidence\\runtime\\RUN-SL11-HANDOFF-20261011\\intent-5b7fc1160c3b49a486edad991847679d.json","redacted":true,"run_id":"RUN-SL11-HANDOFF-20261011","sha256":"c607f86c422d79ec88cf39e5b3475a910e5b2a5cb9b2c82a92df36117d5f8200","source":"EXECUTOR"}