{"created_at_utc":"2026-10-10T18:01:41.313001Z","derived_from":[],"evidence_id":"EV-INTENT-450d4a610f39","expected_state":"INTENT_RECORDED","observed_state":"INTENT_RECORDED","path":"evidence\\runtime\\RUN-SL09-LIVE\\intent-459f9a057ffd4d70b35d45e766f95c3b.json","redacted":true,"run_id":"RUN-SL09-LIVE","sha256":"dd431615192a0b5491969439427664d41859f15476fe14ef94a96d2f5f84f216","source":"EXECUTOR"}