{"created_at_utc":"2026-10-10T17:24:36.481668Z","derived_from":[],"evidence_id":"EV-RESULT-e9e2f1d9482b","expected_state":"DISPATCH_CONFIRMED","observed_state":"DISPATCH_CONFIRMED","path":"evidence\\runtime\\RUN-SL08-LIVE\\result-c149b06ac9d04f2cb54a03f25e2d7d20.json","redacted":true,"run_id":"RUN-SL08-LIVE","sha256":"aa4424d52a6f75f97cb57bcfc616c1ae28f3846ecc5f6019f4e79ec38155222b","source":"EXECUTOR"}