{"created_at_utc":"2026-10-11T09:56:43.380131Z","derived_from":[],"evidence_id":"EV-RESULT-8c6fe413fef3","expected_state":"DISPATCH_CONFIRMED","observed_state":"DISPATCH_CONFIRMED","path":"evidence\\runtime\\RUN-AUTONOMOUS-PENTEST-1791712598\\result-64d5d7014d984143989ee9de9ae3c4ff.json","redacted":true,"run_id":"RUN-AUTONOMOUS-PENTEST-1791712598","sha256":"63b6d1f28a3d505b427c4e8d5526b367c23a36ed288e5d0e92057c2f339e9663","source":"EXECUTOR"}