{"created_at_utc":"2026-10-11T13:06:49.632237Z","derived_from":[],"evidence_id":"EV-RESULT-559fbeef8abd","expected_state":"DISPATCH_CONFIRMED","observed_state":"DISPATCH_CONFIRMED","path":"evidence\\runtime\\RUN-AUTONOMOUS-PENTEST-1791723996\\result-84690936d7164e40991111702911b97d.json","redacted":true,"run_id":"RUN-AUTONOMOUS-PENTEST-1791723996","sha256":"bc829ef66f69a6274ef4e8fa50e5743676bae7eab0d4fb3d932ade647b80947f","source":"EXECUTOR"}