{"created_at_utc":"2026-10-11T09:56:02.000608Z","derived_from":[],"evidence_id":"EV-INTENT-3cfa74770046","expected_state":"INTENT_RECORDED","observed_state":"INTENT_RECORDED","path":"evidence\\runtime\\RUN-AUTONOMOUS-PENTEST-1791712555\\intent-93f72ac9b0264a5285fa3f02d378a130.json","redacted":true,"run_id":"RUN-AUTONOMOUS-PENTEST-1791712555","sha256":"db9ed89060420e2bfbd304183e88e64ba726abf855602b6a881fb9ad338fe0a0","source":"EXECUTOR"}