{"created_at_utc":"2026-10-11T09:55:59.778343Z","derived_from":[],"evidence_id":"EV-RESULT-396931938781","expected_state":"DISPATCH_CONFIRMED","observed_state":"DISPATCH_CONFIRMED","path":"evidence\\runtime\\RUN-AUTONOMOUS-PENTEST-1791712555\\result-68ffa8d2ee2240a798c35688e4adbb97.json","redacted":true,"run_id":"RUN-AUTONOMOUS-PENTEST-1791712555","sha256":"3edbab8c2b1362456bbabcea478221ed897eeeef94c3c963a6f89e38dd0c7cd6","source":"EXECUTOR"}